N101	News	Politics	City council approves housing proposal	Local officials approved a housing proposal after a late-night vote.	https://civicdaily.example/news/n101	[]	[]
N102	Sports	Basketball	Guard leads comeback in season opener	A fourth-quarter rally lifted the home team in the season opener.	https://sportswire.example/news/n102	[]	[]
N103	Finance	Markets	Stocks climb as rate fears ease	Markets closed higher as investors responded to softer rate concerns.	https://marketdesk.example/news/n103	[]	[]
N104	Entertainment	Movies	Director announces sequel release date	A studio confirmed the release window for an upcoming sequel.	https://screenbeat.example/news/n104	[]	[]
N105	Health	Nutrition	Study highlights benefits of high-fiber lunches	Researchers found that higher-fiber lunches improved afternoon satiety.	https://wellnesshub.example/news/n105	[]	[]
N106	Tech	AI	Startups race to launch new workplace AI tools	Several startups introduced AI assistants aimed at workplace productivity.	https://techradar.example/news/n106	[]	[]
